{
  "schemaVersion": 1,
  "locale": "es",
  "generatedAt": "2026-10-24T00:00:00.000Z",
  "categories": [
    {
      "id": "web-development",
      "title": "Desarrollo web",
      "description": "Frontend, backend, APIs, datos, pruebas, accesibilidad y rendimiento.",
      "skills": [
        {
          "id": "api-design-review",
          "name": "Revisión de diseño de API",
          "summary": "Evaluar una API por consistencia, seguridad, evolucion y experiencia de consumo.",
          "version": "0.1.0",
          "status": "experimental",
          "riskLevel": "medium",
          "tags": [
            "api",
            "review",
            "security"
          ],
          "source": "../../skills/web-development/api-design-review/locales/es/SKILL.md"
        },
        {
          "id": "desarrollo-ideavo-opencode",
          "name": "Desarrollo IDEAVO - OpenCode",
          "summary": "Flujo general de desarrollo seguro, verificable y gobernado para proyectos trabajados con IDEAVO en OpenCode.",
          "version": "0.3.0",
          "status": "experimental",
          "riskLevel": "high",
          "tags": [
            "ideavo",
            "opencode",
            "software-development",
            "security",
            "validation"
          ],
          "source": "../../skills/web-development/desarrollo-ideavo-opencode/locales/es/SKILL.md"
        },
        {
          "id": "web-performance-audit",
          "name": "Auditoria de rendimiento web",
          "summary": "Identificar cuellos de botella y proponer mejoras medibles de rendimiento web.",
          "version": "0.1.0",
          "status": "experimental",
          "riskLevel": "low",
          "tags": [
            "performance",
            "core-web-vitals",
            "audit"
          ],
          "source": "../../skills/web-development/web-performance-audit/locales/es/SKILL.md"
        },
        {
          "id": "web-project-bootstrap",
          "name": "Preparación de proyecto web",
          "summary": "Preparar una base web mantenible con decisiones, estructura y controles iniciales.",
          "version": "0.1.0",
          "status": "experimental",
          "riskLevel": "low",
          "tags": [
            "bootstrap",
            "architecture",
            "quality"
          ],
          "source": "../../skills/web-development/web-project-bootstrap/locales/es/SKILL.md"
        }
      ]
    },
    {
      "id": "devops-cloud",
      "title": "DevOps y cloud",
      "description": "Entrega continua, infraestructura, contenedores, observabilidad y seguridad cloud.",
      "skills": [
        {
          "id": "ci-cd-pipeline-design",
          "name": "Diseño de pipeline CI/CD",
          "summary": "Diseñar una entrega automatizada con controles, trazabilidad y recuperación.",
          "version": "0.1.0",
          "status": "experimental",
          "riskLevel": "high",
          "tags": [
            "ci-cd",
            "automation",
            "release"
          ],
          "source": "../../skills/devops-cloud/ci-cd-pipeline-design/locales/es/SKILL.md"
        },
        {
          "id": "cloud-architecture-review",
          "name": "Revisión de arquitectura cloud",
          "summary": "Evaluar una arquitectura cloud por fiabilidad, seguridad, rendimiento y coste.",
          "version": "0.1.0",
          "status": "experimental",
          "riskLevel": "high",
          "tags": [
            "cloud",
            "architecture",
            "cost-optimization"
          ],
          "source": "../../skills/devops-cloud/cloud-architecture-review/locales/es/SKILL.md"
        },
        {
          "id": "containerize-web-application",
          "name": "Contenerización de una aplicación web",
          "summary": "Crear una imagen reproducible, segura y operable para una aplicación web.",
          "version": "0.1.0",
          "status": "experimental",
          "riskLevel": "medium",
          "tags": [
            "docker",
            "containers",
            "deployment"
          ],
          "source": "../../skills/devops-cloud/containerize-web-application/locales/es/SKILL.md"
        },
        {
          "id": "dokploy-compose-deployment",
          "name": "Despliegue Dokploy en modo Compose multi-entorno",
          "summary": "Crear, promover y diagnosticar recursos Docker Compose de Dokploy con nombres técnicos explícitos, variables protegidas, dominios y flujo master -> production.",
          "version": "0.7.0",
          "status": "experimental",
          "riskLevel": "high",
          "tags": [
            "dokploy",
            "docker-compose",
            "compose-deployment",
            "explicit-app-name",
            "environment-promotion",
            "traefik",
            "domains",
            "postgres",
            "rollback",
            "smoke-tests"
          ],
          "source": "../../skills/devops-cloud/dokploy-compose-deployment/locales/es/SKILL.md"
        },
        {
          "id": "dokploy-swarm-stack-deployment",
          "name": "Despliegue Dokploy en modo Stack (Swarm)",
          "summary": "Preparar, promover y diagnosticar stacks Dokploy/Swarm con gates de backup verificable, builds API-only, mantenimiento independiente y bindings site/app.",
          "version": "0.6.2",
          "status": "experimental",
          "riskLevel": "high",
          "tags": [
            "dokploy",
            "docker-swarm",
            "stack-deployment",
            "ghcr",
            "private-registry",
            "api-only-build",
            "native-volume-backup",
            "single-node",
            "promotion",
            "site-app-domains",
            "traefik",
            "rollback",
            "smoke-tests"
          ],
          "source": "../../skills/devops-cloud/dokploy-swarm-stack-deployment/locales/es/SKILL.md"
        },
        {
          "id": "openship-actions-ci",
          "name": "CI con OpenShip Actions y runners propios",
          "summary": "Ejecutar validaciones CI en infraestructura propia con OpenShip Actions, en modo independiente o con runners self-hosted para workflows de GitHub, con alternativa endurecida en Dokploy.",
          "version": "0.1.0",
          "status": "experimental",
          "riskLevel": "high",
          "tags": [
            "openship",
            "actions",
            "ci-cd",
            "self-hosted-runner",
            "github-actions",
            "dokploy",
            "validation",
            "hardening"
          ],
          "source": "../../skills/devops-cloud/openship-actions-ci/locales/es/SKILL.md"
        },
        {
          "id": "openship-project-environments",
          "name": "Despliegue OpenShip por proyecto y entornos",
          "summary": "Operar proyectos OpenShip con Production y Preview, servicios persistentes, migraciones PostgreSQL, backups verificables, promoción y rollback.",
          "version": "0.1.1",
          "status": "experimental",
          "riskLevel": "high",
          "tags": [
            "openship",
            "self-hosted",
            "project-environments",
            "preview",
            "production",
            "docker-compose",
            "postgres",
            "migration",
            "backup",
            "rollback",
            "cloudflare",
            "atlas"
          ],
          "source": "../../skills/devops-cloud/openship-project-environments/locales/es/SKILL.md"
        }
      ]
    },
    {
      "id": "hosting-support",
      "title": "Alojamiento y soporte",
      "description": "DNS, servidores, migraciónes, copias de seguridad, correo y soporte técnico.",
      "skills": [
        {
          "id": "backup-and-restore",
          "name": "Copias de seguridad y restauracion",
          "summary": "Definir y verificar una estrategia de backup basada en objetivos de recuperación.",
          "version": "0.1.0",
          "status": "experimental",
          "riskLevel": "high",
          "tags": [
            "backup",
            "disaster-recovery",
            "operations"
          ],
          "source": "../../skills/hosting-support/backup-and-restore/locales/es/SKILL.md"
        },
        {
          "id": "dns-configuration",
          "name": "Configuración de DNS",
          "summary": "Planificar y aplicar cambios DNS con validación y recuperación segura.",
          "version": "0.1.0",
          "status": "experimental",
          "riskLevel": "high",
          "tags": [
            "dns",
            "hosting",
            "change-management"
          ],
          "source": "../../skills/hosting-support/dns-configuration/locales/es/SKILL.md"
        },
        {
          "id": "website-migration",
          "name": "Migración de sitio web",
          "summary": "Mover un sitio entre entornos reduciendo pérdida de datos y tiempo de inactividad.",
          "version": "0.1.0",
          "status": "experimental",
          "riskLevel": "high",
          "tags": [
            "migration",
            "hosting",
            "backup"
          ],
          "source": "../../skills/hosting-support/website-migration/locales/es/SKILL.md"
        }
      ]
    },
    {
      "id": "digital-marketing",
      "title": "Marketing digital",
      "description": "SEO, analítica, contenidos, publicidad, conversión y automatizacion.",
      "skills": [
        {
          "id": "analytics-measurement-plan",
          "name": "Plan de medición analítica",
          "summary": "Convertir objetivos de negocio en eventos, dimensiones, KPI y controles de calidad.",
          "version": "0.1.0",
          "status": "experimental",
          "riskLevel": "medium",
          "tags": [
            "analytics",
            "measurement",
            "privacy"
          ],
          "source": "../../skills/digital-marketing/analytics-measurement-plan/locales/es/SKILL.md"
        },
        {
          "id": "conversion-rate-audit",